{
  "incidentId": "IR-20260520-0002",
  "source": {
    "type": "erp",
    "name": "sap-erp-prod",
    "detectorConfidence": 1.0
  },
  "occurredAt": "2026-05-20T11:02:00Z",
  "severity": "medium",
  "subject": "Material deviation: incoming lot fails dimensional tolerance on PRT-4521-Rev-C",
  "description": "Incoming inspection on lot RCV-2026-05-20-0033 from supplier ACME flagged 14 units (of 200) out of dimensional tolerance for part PRT-4521-Rev-C. Specification calls for 12.50 ± 0.05 mm on the mounting hole; measured 12.61–12.64 mm on the rejected units. ERP auto-raised this as a material deviation event (event code MAT-DEV-014).",
  "affectedItems": [
    {
      "itemId": "PRT-4521-Rev-C",
      "itemType": "part",
      "supplierId": "sup-acme-001",
      "quantity": 14
    }
  ],
  "complianceClass": "iatf-16949",
  "evidence": [
    {
      "kind": "report",
      "uri": "https://sap.internal/qm/inspection-reports/RCV-2026-05-20-0033.pdf",
      "caption": "Incoming inspection report"
    }
  ],
  "reportedBy": {
    "principalType": "service-account",
    "principalId": "sap-qm-bridge",
    "displayName": "SAP QM → BPMN bridge"
  },
  "tags": ["material-deviation", "dimensional-tolerance", "supplier-acme"],
  "vendor": {
    "sap": {
      "eventCode": "MAT-DEV-014",
      "lotId": "RCV-2026-05-20-0033",
      "inspectionLotId": "0050081234",
      "rejectedQty": 14,
      "totalQty": 200,
      "spec": { "dim": "mounting_hole_diameter", "nominal_mm": 12.5, "tolerance_mm": 0.05 },
      "measurements_mm": [12.61, 12.64, 12.62, 12.63, 12.61, 12.62, 12.63, 12.64, 12.61, 12.62, 12.63, 12.62, 12.61, 12.63]
    }
  }
}
