{
  "incidentId": "IR-20260520-0001",
  "source": {
    "type": "vision",
    "name": "aoi-vision",
    "detectorConfidence": 0.94
  },
  "occurredAt": "2026-05-20T08:14:23Z",
  "severity": "high",
  "subject": "NG_WIRING: misrouted cable detected on panel A-12, line 3",
  "description": "The AOI vision system flagged a wiring routing deviation on control panel A-12 at inspection station 3. Expected routing path passes terminals T7-T9; observed routing bypasses T8 and shorts directly T7-T9 via the upper bus. Three consecutive frames at 0.94 confidence; no false-positive in the prior 200 frames at this station.",
  "affectedItems": [
    {
      "itemId": "PNL-A12-Rev-D",
      "itemType": "assembly",
      "supplierId": "sup-acme-001",
      "quantity": 1
    },
    {
      "itemId": "WHN-A12-cable-7",
      "itemType": "part",
      "supplierId": "sup-acme-001",
      "quantity": 1
    }
  ],
  "complianceClass": "as9100",
  "evidence": [
    {
      "kind": "image",
      "uri": "s3://aoi-evidence/2026-05-20/IR-20260520-0001/frame-08-14-23.jpg",
      "caption": "Annotated frame showing misrouted cable (red overlay)"
    },
    {
      "kind": "image",
      "uri": "s3://aoi-evidence/2026-05-20/IR-20260520-0001/frame-08-14-24.jpg",
      "caption": "Second confirmation frame"
    },
    {
      "kind": "log",
      "uri": "s3://aoi-evidence/2026-05-20/IR-20260520-0001/inference-log.json",
      "caption": "Per-frame detector output across the 200-frame window"
    }
  ],
  "reportedBy": {
    "principalType": "automated-detector",
    "principalId": "aoi-detector-station-3",
    "displayName": "AOI Station 3 Detector"
  },
  "tags": ["wiring", "panel-A", "shift-2", "as9100"],
  "vendor": {
    "aoi": {
      "detectorVersion": "aoi-2.6.1",
      "modelId": "wiring-defect-v17",
      "stationId": "station-3",
      "rawLabel": "NG_WIRING",
      "boundingBox": { "x": 412, "y": 268, "w": 156, "h": 94 },
      "frameSeq": [3401, 3402, 3403]
    }
  }
}
