{
  "incidentId": "IR-20260520-0003",
  "source": {
    "type": "manual",
    "name": "qa-web-portal",
    "detectorConfidence": 1.0
  },
  "occurredAt": "2026-05-20T14:37:12Z",
  "severity": "low",
  "subject": "Operator-reported intermittent label misprint on Line 7",
  "description": "Operator reports that approximately every 25th unit on Line 7 receives a misprinted label — the part number prints correctly but the lot suffix is missing the trailing two characters. Issue began at the start of shift 2 today. No automated detector flagged this; reported via QA web portal.",
  "affectedItems": [
    {
      "itemId": "LBL-prtnum-suffix-line7",
      "itemType": "configuration-item",
      "quantity": 0
    }
  ],
  "complianceClass": "iso13485",
  "evidence": [
    {
      "kind": "image",
      "uri": "https://qa-portal.internal/uploads/2026-05-20/op-jdoe/label-misprint-sample.jpg",
      "caption": "Sample misprinted label photographed by operator"
    }
  ],
  "reportedBy": {
    "principalType": "human",
    "principalId": "u-jdoe",
    "displayName": "Operator J. Doe (Line 7, Shift 2)"
  },
  "tags": ["label", "line-7", "shift-2", "intermittent"],
  "vendor": {
    "qaPortal": {
      "submissionId": "qa-sub-2026-05-20-0157",
      "formVersion": "v3.2"
    }
  }
}
