{
  "incidentId": "IR-20260520-0004",
  "source": {
    "type": "supplier",
    "name": "acme-supplier-deviation-feed",
    "detectorConfidence": 1.0
  },
  "occurredAt": "2026-05-20T09:21:55Z",
  "severity": "high",
  "subject": "Supplier deviation: ACME requests substitution for harness connector model HC-220 → HC-230 due to discontinuation",
  "description": "ACME (sup-acme-001) submitted a formal deviation report informing us that connector HC-220 has been discontinued by the upstream component manufacturer. They request to substitute HC-230 (form-fit compatible per supplier; electrical spec identical) effective lot 2026-06-15 onward. This requires our engineering acknowledgement and qualification approval before they can ship.",
  "affectedItems": [
    {
      "itemId": "HC-220",
      "itemType": "part",
      "supplierId": "sup-acme-001",
      "quantity": 0
    },
    {
      "itemId": "WHN-A12-cable-7",
      "itemType": "assembly",
      "supplierId": "sup-acme-001",
      "quantity": 0
    }
  ],
  "complianceClass": "as9100",
  "evidence": [
    {
      "kind": "pdf",
      "uri": "https://supplier-portal.internal/acme/deviations/DEV-2026-05-20-007.pdf",
      "caption": "ACME formal deviation report"
    },
    {
      "kind": "report",
      "uri": "https://supplier-portal.internal/acme/datasheets/HC-230-spec-v2.pdf",
      "caption": "HC-230 electrical and dimensional spec"
    }
  ],
  "reportedBy": {
    "principalType": "service-account",
    "principalId": "supplier-acme-edi-bridge",
    "displayName": "ACME supplier EDI → BPMN bridge"
  },
  "tags": ["supplier-deviation", "discontinuation", "substitution", "acme", "as9100"],
  "vendor": {
    "supplier": {
      "supplierId": "sup-acme-001",
      "deviationId": "DEV-2026-05-20-007",
      "requestType": "part-substitution",
      "from": "HC-220",
      "to": "HC-230",
      "effectiveLot": "2026-06-15",
      "supplierClaim": "form-fit-electrical-compatible"
    }
  }
}
